<?xml version="1.0" encoding="UTF-8"?>
<!DOCTYPE list SYSTEM "skills.dtd">
<list>
  <skill id="21000" levels="1" name="Release Seal on Agathion - Majo">
    <set name="target" val="TARGET_SELF" />
    <set name="skillType" val="AGATHION" />
    <set name="hitTime" val="3000" />
    <set name="staticHitTime" val="true" />
    <set name="operateType" val="OP_ACTIVE" />
    <set name="npcId" val="1501" />
    <set name="castRange" val="-1" />
    <set name="effectRange" val="-1" />
  </skill>
  <skill id="21001" levels="1" name="Release Seal on Agathion - Gold Majo">
    <set name="target" val="TARGET_SELF" />
    <set name="skillType" val="AGATHION" />
    <set name="hitTime" val="3000" />
    <set name="staticHitTime" val="true" />
    <set name="operateType" val="OP_ACTIVE" />
    <set name="npcId" val="1502" />
    <set name="castRange" val="-1" />
    <set name="effectRange" val="-1" />
  </skill>
  <skill id="21002" levels="1" name="Release Seal on Agathion - Black Majo">
    <set name="target" val="TARGET_SELF" />
    <set name="skillType" val="AGATHION" />
    <set name="hitTime" val="3000" />
    <set name="staticHitTime" val="true" />
    <set name="operateType" val="OP_ACTIVE" />
    <set name="npcId" val="1503" />
    <set name="castRange" val="-1" />
    <set name="effectRange" val="-1" />
  </skill>
  <skill id="21003" levels="1" name="Release Seal on Agathion - Plaipitak">
    <set name="target" val="TARGET_SELF" />
    <set name="skillType" val="AGATHION" />
    <set name="hitTime" val="3000" />
    <set name="staticHitTime" val="true" />
    <set name="operateType" val="OP_ACTIVE" />
    <set name="npcId" val="1504" />
    <set name="castRange" val="-1" />
    <set name="effectRange" val="-1" />
  </skill>
  <skill id="21004" levels="1" name="Wind Walk">
    <set name="target" val="TARGET_NONE" />
    <set name="skillType" val="NOTDONE" />
    <set name="operateType" val="OP_PASSIVE" />
    <set name="castRange" val="-1" />
  </skill>
  <skill id="21005" levels="3" name="Agility">
    <set name="target" val="TARGET_NONE" />
    <set name="skillType" val="NOTDONE" />
    <set name="operateType" val="OP_PASSIVE" />
    <set name="castRange" val="-1" />
  </skill>
  <skill id="21006" levels="1" name="Large Firework Effect">
    <set name="target" val="TARGET_NONE" />
    <set name="skillType" val="NOTDONE" />
    <set name="operateType" val="OP_PASSIVE" />
    <set name="castRange" val="-1" />
  </skill>
  <skill id="21007" levels="1" name="Ability of Doubt">
    <set name="target" val="TARGET_NONE" />
    <set name="skillType" val="NOTDONE" />
    <set name="operateType" val="OP_PASSIVE" />
    <set name="castRange" val="-1" />
  </skill>
  <skill id="21008" levels="1" name="Release Seal on Agathion - Baby Panda">
    <set name="target" val="TARGET_NONE" />
    <set name="skillType" val="NOTDONE" />
    <set name="operateType" val="OP_PASSIVE" />
    <set name="castRange" val="-1" />
  </skill>
  <skill id="21009" levels="1" name="Release Seal on Agathion - Bamboo Panda">
    <set name="target" val="TARGET_NONE" />
    <set name="skillType" val="NOTDONE" />
    <set name="operateType" val="OP_PASSIVE" />
    <set name="castRange" val="-1" />
  </skill>
  <skill id="21010" levels="1" name="Release Seal on Agathion - Sexy Panda">
    <set name="target" val="TARGET_NONE" />
    <set name="skillType" val="NOTDONE" />
    <set name="operateType" val="OP_PASSIVE" />
    <set name="castRange" val="-1" />
  </skill>
  <skill id="21011" levels="1" name="Energy Recovery">
    <set name="target" val="TARGET_NONE" />
    <set name="skillType" val="NOTDONE" />
    <set name="operateType" val="OP_PASSIVE" />
    <set name="castRange" val="-1" />
  </skill>
  <skill id="21012" levels="1" name="Energy Recovery">
    <set name="target" val="TARGET_NONE" />
    <set name="skillType" val="NOTDONE" />
    <set name="operateType" val="OP_PASSIVE" />
    <set name="castRange" val="-1" />
  </skill>
  <skill id="21013" levels="1" name="Energy Recovery">
    <set name="target" val="TARGET_NONE" />
    <set name="skillType" val="NOTDONE" />
    <set name="operateType" val="OP_PASSIVE" />
    <set name="castRange" val="-1" />
  </skill>
  <skill id="21014" levels="1" name="Scissors">
    <set name="target" val="TARGET_NONE" />
    <set name="skillType" val="NOTDONE" />
    <set name="operateType" val="OP_PASSIVE" />
    <set name="castRange" val="-1" />
  </skill>
  <skill id="21015" levels="1" name="Rock">
    <set name="target" val="TARGET_NONE" />
    <set name="skillType" val="NOTDONE" />
    <set name="operateType" val="OP_PASSIVE" />
    <set name="castRange" val="-1" />
  </skill>
  <skill id="21016" levels="1" name="Paper">
    <set name="target" val="TARGET_NONE" />
    <set name="skillType" val="NOTDONE" />
    <set name="operateType" val="OP_PASSIVE" />
    <set name="castRange" val="-1" />
  </skill>
  <skill id="21017" levels="1" name="Holiday Dream Weapon">
    <set name="target" val="TARGET_NONE" />
    <set name="skillType" val="NOTDONE" />
    <set name="operateType" val="OP_PASSIVE" />
    <set name="castRange" val="-1" />
  </skill>
  <skill id="21018" levels="1" name="Holiday Dream Weapon">
    <set name="target" val="TARGET_NONE" />
    <set name="skillType" val="NOTDONE" />
    <set name="operateType" val="OP_PASSIVE" />
    <set name="castRange" val="-1" />
  </skill>
  <skill id="21019" levels="1" name="Holiday Dream Weapon">
    <set name="target" val="TARGET_NONE" />
    <set name="skillType" val="NOTDONE" />
    <set name="operateType" val="OP_PASSIVE" />
    <set name="castRange" val="-1" />
  </skill>
  <skill id="21020" levels="1" name="Holiday Dream Weapon">
    <set name="target" val="TARGET_NONE" />
    <set name="skillType" val="NOTDONE" />
    <set name="operateType" val="OP_PASSIVE" />
    <set name="castRange" val="-1" />
  </skill>
  <skill id="21021" levels="1" name="Holiday Dream Weapon">
    <set name="target" val="TARGET_NONE" />
    <set name="skillType" val="NOTDONE" />
    <set name="operateType" val="OP_PASSIVE" />
    <set name="castRange" val="-1" />
  </skill>
  <skill id="21022" levels="1" name="Holiday Dream Weapon">
    <set name="target" val="TARGET_NONE" />
    <set name="skillType" val="NOTDONE" />
    <set name="operateType" val="OP_PASSIVE" />
    <set name="castRange" val="-1" />
  </skill>
  <skill id="21023" levels="1" name="Holiday Dream Weapon">
    <set name="target" val="TARGET_NONE" />
    <set name="skillType" val="NOTDONE" />
    <set name="operateType" val="OP_PASSIVE" />
    <set name="castRange" val="-1" />
  </skill>
  <skill id="21024" levels="1" name="Holiday Dream Weapon">
    <set name="target" val="TARGET_NONE" />
    <set name="skillType" val="NOTDONE" />
    <set name="operateType" val="OP_PASSIVE" />
    <set name="castRange" val="-1" />
  </skill>
  <skill id="21025" levels="1" name="Holiday Dream Weapon">
    <set name="target" val="TARGET_NONE" />
    <set name="skillType" val="NOTDONE" />
    <set name="operateType" val="OP_PASSIVE" />
    <set name="castRange" val="-1" />
  </skill>
  <skill id="21026" levels="1" name="Holiday Dream Weapon">
    <set name="target" val="TARGET_NONE" />
    <set name="skillType" val="NOTDONE" />
    <set name="operateType" val="OP_PASSIVE" />
    <set name="castRange" val="-1" />
  </skill>
  <skill id="21027" levels="1" name="Holiday Dream Weapon">
    <set name="target" val="TARGET_NONE" />
    <set name="skillType" val="NOTDONE" />
    <set name="operateType" val="OP_PASSIVE" />
    <set name="castRange" val="-1" />
  </skill>
  <skill id="21028" levels="1" name="Holiday Dream Weapon">
    <set name="target" val="TARGET_NONE" />
    <set name="skillType" val="NOTDONE" />
    <set name="operateType" val="OP_PASSIVE" />
    <set name="castRange" val="-1" />
  </skill>
  <skill id="21029" levels="1" name="Holiday Dream Weapon">
    <set name="target" val="TARGET_NONE" />
    <set name="skillType" val="NOTDONE" />
    <set name="operateType" val="OP_PASSIVE" />
    <set name="castRange" val="-1" />
  </skill>
  <skill id="21030" levels="1" name="Holiday Dream Weapon">
    <set name="target" val="TARGET_NONE" />
    <set name="skillType" val="NOTDONE" />
    <set name="operateType" val="OP_PASSIVE" />
    <set name="castRange" val="-1" />
  </skill>
</list>