<?xml version='1.0' encoding='utf-8'?>
<!DOCTYPE list SYSTEM "skills.dtd">
<list>
<skill id="2300" levels="1" name="Hair Style Change Potion">
  <set name="target" val="TARGET_NONE"/>
  <set name="skillType" val="NOTDONE"/>
  <set name="operateType" val="OP_ACTIVE"/>
  <set name="castRange" val="-1"/>
  <for>
  </for>
</skill>
<skill id="2301" levels="1" name="Hair Style Change Potion">
  <set name="target" val="TARGET_NONE"/>
  <set name="skillType" val="NOTDONE"/>
  <set name="operateType" val="OP_ACTIVE"/>
  <set name="castRange" val="-1"/>
  <for>
  </for>
</skill>
<skill id="2302" levels="1" name="Hair Style Change Potion">
  <set name="target" val="TARGET_NONE"/>
  <set name="skillType" val="NOTDONE"/>
  <set name="operateType" val="OP_ACTIVE"/>
  <set name="castRange" val="-1"/>
  <for>
  </for>
</skill>
<skill id="2303" levels="1" name="Hair Style Change Potion">
  <set name="target" val="TARGET_NONE"/>
  <set name="skillType" val="NOTDONE"/>
  <set name="operateType" val="OP_ACTIVE"/>
  <set name="castRange" val="-1"/>
  <for>
  </for>
</skill>
<skill id="2304" levels="1" name="Hair Style Change Potion">
  <set name="target" val="TARGET_NONE"/>
  <set name="skillType" val="NOTDONE"/>
  <set name="operateType" val="OP_ACTIVE"/>
  <set name="castRange" val="-1"/>
  <for>
  </for>
</skill>
<skill id="2305" levels="1" name="Primeval Potion">
<!--
  Needs to be finished.
  Target is set to TARGET_NONE, skillType to NOTDONE for server compatability.
  Description(s):
      Improves resistance to various poisons and anesthetics that originate on the Primeval Isle.
-->
  <set name="target" val="TARGET_NONE"/>
  <set name="skillType" val="NOTDONE"/>
  <set name="operateType" val="OP_PASSIVE"/>
  <set name="castRange" val="-1"/>
  <for>
  </for>
</skill>
<skill id="2306" levels="3" name="Primeval Crystals">
<!--
  Needs to be finished.
  Target is set to TARGET_NONE, skillType to NOTDONE for server compatability.
  Description(s):
      Lvl 1 Name - Blue Primeval Crystal
	  Lvl 2 Name - Green Primeval Crystal
	  Lvl 3 Name - Red Primeval Crystal
-->
  <set name="target" val="TARGET_NONE"/>
  <set name="skillType" val="NOTDONE"/>
  <set name="operateType" val="OP_PASSIVE"/>
  <set name="castRange" val="-1"/>
  <for>
  </for>
</skill>
<skill id="2307" levels="1" name="Remove Petrification Scroll">
<!--
  Needs to be finished.
  Target is set to TARGET_NONE, skillType to NOTDONE for server compatability.
  Description(s):
      none
-->
  <set name="target" val="TARGET_NONE"/>
  <set name="skillType" val="NOTDONE"/>
  <set name="operateType" val="OP_PASSIVE"/>
  <set name="castRange" val="-1"/>
  <for>
  </for>
</skill>
<skill id="2308" levels="36" name="Event Item">
<!--
  Needs to be finished.
  Target is set to TARGET_NONE, skillType to NOTDONE for server compatability.
  Description(s):
      Lvl 1-36 Name - Event Item
-->
  <set name="target" val="TARGET_NONE"/>
  <set name="skillType" val="NOTDONE"/>
  <set name="operateType" val="OP_PASSIVE"/>
  <set name="castRange" val="-1"/>
  <for>
  </for>
</skill>
<skill id="2309" levels="1" name="Pig Chest">
<!--
  Needs to be finished.
  Target is set to TARGET_NONE, skillType to NOTDONE for server compatability.
  Description(s):
      Lvl 1 - none
-->
  <set name="target" val="TARGET_NONE"/>
  <set name="skillType" val="NOTDONE"/>
  <set name="operateType" val="OP_PASSIVE"/>
  <set name="castRange" val="-1"/>
  <for>
  </for>
</skill>
<skill id="2310" levels="1" name="Scroll of Guidance - Event Use">
<!--
  Needs to be finished.
  Target is set to TARGET_NONE, skillType to NOTDONE for server compatability.
  Description(s):
      Lvl 1 - Increases Accuracy. Effect 3.
-->
  <set name="target" val="TARGET_NONE"/>
  <set name="skillType" val="NOTDONE"/>
  <set name="operateType" val="OP_PASSIVE"/>
  <set name="castRange" val="-1"/>
  <for>
  </for>
</skill>
<skill id="2311" levels="1" name="Scroll of Death Whisper - Event Use">
<!--
  Needs to be finished.
  Target is set to TARGET_NONE, skillType to NOTDONE for server compatability.
  Description(s):
      Lvl 1 - Increases critical attack power. Effect 3.
-->
  <set name="target" val="TARGET_NONE"/>
  <set name="skillType" val="NOTDONE"/>
  <set name="operateType" val="OP_PASSIVE"/>
  <set name="castRange" val="-1"/>
  <for>
  </for>
</skill>
<skill id="2312" levels="1" name="Scroll of Focus - Event Use">
<!--
  Needs to be finished.
  Target is set to TARGET_NONE, skillType to NOTDONE for server compatability.
  Description(s):
      Lvl 1 - Increases critical attack rate. Effect 3.
-->
  <set name="target" val="TARGET_NONE"/>
  <set name="skillType" val="NOTDONE"/>
  <set name="operateType" val="OP_PASSIVE"/>
  <set name="castRange" val="-1"/>
  <for>
  </for>
</skill>
<skill id="2313" levels="1" name="Scroll of Acumen - Event Use">
<!--
  Needs to be finished.
  Target is set to TARGET_NONE, skillType to NOTDONE for server compatability.
  Description(s):
      Lvl 1 - Increases Casting Spd. Effect 3.
-->
  <set name="target" val="TARGET_NONE"/>
  <set name="skillType" val="NOTDONE"/>
  <set name="operateType" val="OP_PASSIVE"/>
  <set name="castRange" val="-1"/>
  <for>
  </for>
</skill>
<skill id="2314" levels="1" name="Scroll of Haste - Event Use">
<!--
  Needs to be finished.
  Target is set to TARGET_NONE, skillType to NOTDONE for server compatability.
  Description(s):
      Lvl 1 - Increases Atk. Spd. Effect 2.
-->
  <set name="target" val="TARGET_NONE"/>
  <set name="skillType" val="NOTDONE"/>
  <set name="operateType" val="OP_PASSIVE"/>
  <set name="castRange" val="-1"/>
  <for>
  </for>
</skill>
<skill id="2315" levels="1" name="Scroll of Agility - Event Use">
<!--
  Needs to be finished.
  Target is set to TARGET_NONE, skillType to NOTDONE for server compatability.
  Description(s):
      Lvl 1 - Increases Evasion. Effect 3.
-->
  <set name="target" val="TARGET_NONE"/>
  <set name="skillType" val="NOTDONE"/>
  <set name="operateType" val="OP_PASSIVE"/>
  <set name="castRange" val="-1"/>
  <for>
  </for>
</skill>
<skill id="2316" levels="1" name="Scroll of Empower - Event Use">
<!--
  Needs to be finished.
  Target is set to TARGET_NONE, skillType to NOTDONE for server compatability.
  Description(s):
      Lvl 1 - Increases M. Atk. Effect 3.
-->
  <set name="target" val="TARGET_NONE"/>
  <set name="skillType" val="NOTDONE"/>
  <set name="operateType" val="OP_PASSIVE"/>
  <set name="castRange" val="-1"/>
  <for>
  </for>
</skill>
<skill id="2317" levels="1" name="Scroll of Might - Event Use">
<!--
  Needs to be finished.
  Target is set to TARGET_NONE, skillType to NOTDONE for server compatability.
  Description(s):
      Lvl 1 - Increases P. Atk. Effect 3.
-->
  <set name="target" val="TARGET_NONE"/>
  <set name="skillType" val="NOTDONE"/>
  <set name="operateType" val="OP_PASSIVE"/>
  <set name="castRange" val="-1"/>
  <for>
  </for>
</skill>
<skill id="2318" levels="1" name="Scroll of Wind Walk - Event Use">
<!--
  Needs to be finished.
  Target is set to TARGET_NONE, skillType to NOTDONE for server compatability.
  Description(s):
      Lvl 1 - Increases Speed. Effect 2.
-->
  <set name="target" val="TARGET_NONE"/>
  <set name="skillType" val="NOTDONE"/>
  <set name="operateType" val="OP_PASSIVE"/>
  <set name="castRange" val="-1"/>
  <for>
  </for>
</skill>
<skill id="2319" levels="1" name="Scroll of Shield - Event Use">
<!--
  Needs to be finished.
  Target is set to TARGET_NONE, skillType to NOTDONE for server compatability.
  Description(s):
      Lvl 1 - Increases P. Def. Effect 3.
-->
  <set name="target" val="TARGET_NONE"/>
  <set name="skillType" val="NOTDONE"/>
  <set name="operateType" val="OP_PASSIVE"/>
  <set name="castRange" val="-1"/>
  <for>
  </for>
</skill>
<skill id="2320" levels="1" name="Blessed Scroll of Escape - Event Use">
<!--
  Needs to be finished.
  Target is set to TARGET_NONE, skillType to NOTDONE for server compatability.
  Description(s):
      Lvl 1 - none
-->
  <set name="target" val="TARGET_NONE"/>
  <set name="skillType" val="NOTDONE"/>
  <set name="operateType" val="OP_PASSIVE"/>
  <set name="castRange" val="-1"/>
  <for>
  </for>
</skill>
<skill id="2321" levels="1" name="Blessed Scroll of Resurrection - Event Use">
<!--
  Needs to be finished.
  Target is set to TARGET_NONE, skillType to NOTDONE for server compatability.
  Description(s):
      Lvl 1 - none
-->
  <set name="target" val="TARGET_NONE"/>
  <set name="skillType" val="NOTDONE"/>
  <set name="operateType" val="OP_PASSIVE"/>
  <set name="castRange" val="-1"/>
  <for>
  </for>
</skill>
</list>