<?xml version="1.0" encoding="UTF-8"?>
<!DOCTYPE list SYSTEM "../../templates/skills.dtd">
<list>
  <skill id="9007" levels="1" name="Custom Mana Drug">
    <!-- Done by DJ MELERIX -->
    <set name="itemConsumeId" val="726"/>
    <set name="itemConsumeCount" val="1"/>
    <set name="isPotion" val="true"/>
    <set name="magicLvl" val="1"/>
    <set name="operateType" val="OP_ACTIVE"/>
    <set name="skillType" val="MPHOT"/>
    <set name="target" val="TARGET_SELF"/>
    <cond msgId="113" addName="1">
      <player flyMounted="False"/>
    </cond>
    <for>
      <effect count="3" name="ManaHealOverTime" time="5" val="1.5" stackOrder="1.5" stackType="mp_recover"/>
    </for>
  </skill>
  <skill id="9008" levels="1" name="Custom Mana Potion">
    <!-- Done by DJ MELERIX -->
    <set name="itemConsumeId" val="728"/>
    <set name="itemConsumeCount" val="1"/>
    <set name="isPotion" val="true"/>
    <set name="magicLvl" val="1"/>
    <set name="operateType" val="OP_ACTIVE"/>
    <set name="power" val="100"/>
    <set name="skillType" val="MANAHEAL"/>
    <set name="target" val="TARGET_SELF"/>
    <cond msgId="113" addName="1">
      <player flyMounted="False"/>
    </cond>
  </skill>
  <skill id="9009" levels="1" name="Grade Penalty - Weapon">
    <!-- Done by savormix, verified by Psycho -->
    <set name="operateType" val="OP_PASSIVE"/>
    <set name="skillType" val="BUFF"/>
    <set name="target" val="TARGET_SELF"/>
    <set name="stayAfterDeath" val="true"/>
    <set name="sendToClient" val="false"/>
    <for>
      <mul order="0x30" stat="pAtkSpd" val="0.9"/>
      <sub order="0x40" stat="accCombat" val="16"/>
    </for>
  </skill>
  <skill id="9010" levels="5" name="Grade Penalty - Armor">
    <!-- Done by savormix, verified by Psycho -->
    <table name="#AtkSpd"> 0.83 0.69 0.58 0.5 0.5 </table>
    <table name="#rEvas"> 2 4 6 8 10 </table>
    <table name="#runSpd"> 0.83 0.75 0.66 0.59 0.59 </table> <!-- Yes, in percentage -->
    <set name="operateType" val="OP_PASSIVE"/>
    <set name="skillType" val="BUFF"/>
    <set name="target" val="TARGET_SELF"/>
    <set name="stayAfterDeath" val="true"/>
    <set name="sendToClient" val="false"/>
    <for>
      <mul order="0x30" stat="pAtkSpd" val="#AtkSpd">
        <using kind="Sword,Blunt,Dagger,Bow,Pole,Etc,Fist,Dual Sword,Dual Fist,Big Sword,Big Blunt,Ancient,Crossbow,Rapier,Dual Dagger"/>
      </mul>
      <sub order="0x40" stat="rEvas" val="#rEvas"/>
      <mul order="0x30" stat="runSpd" val="#runSpd"/>
      <mul order="0x30" stat="mAtkSpd" val="#AtkSpd"/>
    </for>
  </skill>
</list>
