<?xml version='1.0' encoding='utf-8'?>
<!DOCTYPE list SYSTEM "skills.dtd">
<list>
<skill id="800" levels="3" name="Master Ability - Magic Defense">
  <set name="target" val="TARGET_SELF"/>
  <set name="skillType" val="BUFF"/>
  <set name="operateType" val="OP_PASSIVE"/>
  <set name="castRange" val="-1"/>
  <for>
	<mul order="0x30" val="1.17" stat="mDef"/>
  </for>
</skill>
<skill id="801" levels="1" name="Warrior Ability - Boost CP">
  <set name="target" val="TARGET_SELF"/>
  <set name="skillType" val="BUFF"/>
  <set name="operateType" val="OP_PASSIVE"/>
  <set name="castRange" val="-1"/>
  <for>
	<mul order="0x30" val="1.13" stat="maxCp"/> <!-- Maybe need little correction -->
  </for>
</skill>
<skill id="802" levels="1" name="Wizard Ability - Anti-magic">
  <set name="target" val="TARGET_NONE"/>
  <set name="skillType" val="NOTDONE"/>
  <set name="operateType" val="OP_PASSIVE"/>
  <set name="castRange" val="-1"/>
  <for>
  </for>
</skill>
<skill id="803" levels="1" name="Healer Ability - Divine Protection">
  <set name="target" val="TARGET_NONE"/>
  <set name="skillType" val="NOTDONE"/>
  <set name="operateType" val="OP_PASSIVE"/>
  <set name="castRange" val="-1"/>
  <for>
  </for>
</skill>
<skill id="804" levels="1" name="Knight Ability - Resist Critical">
  <set name="target" val="TARGET_NONE"/>
  <set name="skillType" val="NOTDONE"/>
  <set name="operateType" val="OP_PASSIVE"/>
  <set name="castRange" val="-1"/>
  <for>
  </for>
</skill>
<skill id="805" levels="1" name="not used">
  <set name="target" val="TARGET_NONE"/>
  <set name="skillType" val="NOTDONE"/>
  <set name="operateType" val="OP_PASSIVE"/>
  <set name="castRange" val="-1"/>
  <for>
  </for>
</skill>
<skill id="806" levels="1" name="Magic Obstacle">
  <set name="target" val="TARGET_NONE"/>
  <set name="skillType" val="NOTDONE"/>
  <set name="operateType" val="OP_PASSIVE"/>
  <set name="castRange" val="-1"/>
  <for>
  </for>
</skill>
<skill id="807" levels="1" name="Over-hit">
  <set name="target" val="TARGET_NONE"/>
  <set name="skillType" val="NOTDONE"/>
  <set name="operateType" val="OP_PASSIVE"/>
  <set name="castRange" val="-1"/>
  <for>
  </for>
</skill>
<skill id="808" levels="1" name="Golem Punch">
  <set name="target" val="TARGET_NONE"/>
  <set name="skillType" val="NOTDONE"/>
  <set name="operateType" val="OP_PASSIVE"/>
  <set name="castRange" val="-1"/>
  <for>
  </for>
</skill>
<skill id="809" levels="1" name="Golem Tornado Swing">
  <set name="target" val="TARGET_NONE"/>
  <set name="skillType" val="NOTDONE"/>
  <set name="operateType" val="OP_PASSIVE"/>
  <set name="castRange" val="-1"/>
  <for>
  </for>
</skill>
</list>