<?xml version="1.0" encoding="UTF-8"?>
<!DOCTYPE list SYSTEM "skills.dtd">
<list>
<skill id="7001" levels="1" name="Dispel Buff">
<!--Done by KID-->
  <set name="mpConsume" val="96"/>
  <set name="power" val="0.0"/>
  <set name="target" val="TARGET_ONE"/>
  <set name="hitTime" val="6000"/>
  <set name="reuseDelay" val="300000"/>
  <set name="skillTime" val="6000"/>
  <set name="skillType" val="CANCEL"/>
  <set name="isMagic" val="true"/>
  <set name="operateType" val="OP_ACTIVE"/>
  <set name="castRange" val="600"/>
  <set name="effectRange" val="900"/>
  <set name="negateStats" val="BUFF"/>
  <set name="negatePower" val="17.0"/>
</skill>

<skill id="7002" levels="1" name="Dispel Debuff">
<!--Done by KID-->
  <set name="mpConsume" val="154"/>
  <set name="power" val="0.0"/>
  <set name="target" val="TARGET_ONE"/>
  <set name="hitTime" val="6000"/>
  <set name="reuseDelay" val="300000"/>
  <set name="skillTime" val="6000"/>
  <set name="skillType" val="CANCEL"/>
  <set name="isMagic" val="true"/>
  <set name="operateType" val="OP_ACTIVE"/>
  <set name="castRange" val="600"/>
  <set name="effectRange" val="900"/>
  <set name="negateStats" val="STUN SLEEP MUTE FEAR CONFUSION POISON BLEED DEBUFF WEAKNESS PARALYZE"/>
  <set name="negatePower" val="17.0"/>
</skill>

<skill id="7003" levels="1" name="Dispel All">
<!--Done by KID-->
  <set name="mpConsume" val="74"/>
  <set name="power" val="0.0"/>
  <set name="target" val="TARGET_ONE"/>
  <set name="hitTime" val="6000"/>
  <set name="reuseDelay" val="300000"/>
  <set name="skillTime" val="6000"/>
  <set name="skillType" val="CANCEL"/>
  <set name="isMagic" val="true"/>
  <set name="operateType" val="OP_ACTIVE"/>
  <set name="castRange" val="600"/>
  <set name="effectRange" val="900"/>
  <set name="negateStats" val="STUN SLEEP MUTE FEAR CONFUSION POISON BLEED BUFF DEBUFF WEAKNESS PARALYZE"/>
  <set name="negatePower" val="9.0"/>
</skill>

<skill id="7004" levels="2" name="Disple Petrification">
<!-- TODO -->
  <set name="power" val="0.0"/>
  <set name="target" val="TARGET_SELF"/>
  <set name="skillType" val="PASSIVE"/>
  <set name="operateType" val="OP_PASSIVE"/>
  <set name="isMagic" val="true"/>
  <set name="castRange" val="-1"/>
  <set name="effectRange" val="-1"/>
  <for>
  </for>
</skill>
<skill id="7005" levels="4" name="Greater Chant of Vampire">
<!--Done by KID-->
<table name="#mpConsume"> 154 213 244 272 </table>
<table name="#power"> 1.0 2.0 3.0 7.0 </table>
<table name="#abs"> 15 20 25 70 </table>
  <set name="mpConsume" val="#mpConsume"/>
  <set name="power" val="#power"/>
  <set name="target" val="TARGET_PARTY"/>
  <set name="skillRadius" val="900"/>
  <set name="hitTime" val="2000"/>
  <set name="reuseDelay" val="20000"/>
  <set name="skillTime" val="2000"/>
  <set name="skillType" val="BUFF"/>
  <set name="isMagic" val="true"/>
  <set name="operateType" val="OP_ACTIVE"/>
  <set name="buffDuration" val="1200000"/>
  <set name="castRange" val="-1"/>
  <set name="effectRange" val="-1"/>
  <for>
	<effect count="1" name="Buff" time="1200" val="0" stackOrder="#power" stackType="vampire">
		<add order="0x40" stat="absorbDam" val="#abs"/>
	</effect>
  </for>
</skill>
<skill id="7006" levels="13" name="Pa'agrio's Love">
<!--Done by KID-->
<!--lvl 1-12 dupe-->
  <table name="#hot"> 0 0 0 0 0 0 0 0 0 0 0 0 119 </table>
  <table name="#mpConsume"> 0 0 0 0 0 0 0 0 0 0 0 0 239 </table>
  <set name="mpConsume" val="#mpConsume"/>
  <set name="power" val="6.0"/>
  <set name="target" val="TARGET_ALLY"/>
  <set name="skillRadius" val="1500"/>
  <set name="hitTime" val="2000"/>
  <set name="reuseDelay" val="20000"/>
  <set name="skillTime" val="2000"/>
  <set name="skillType" val="HOT"/>
  <set name="isMagic" val="true"/>
  <set name="operateType" val="OP_ACTIVE"/>
  <set name="buffDuration" val="15000"/>
  <set name="castRange" val="-1"/>
  <set name="effectRange" val="-1"/>
  <for>
   <effect count="6" name="HealOverTime" time="5" val="#hot" stackOrder="#hot" stackType="HpRecoverCast"/>
  </for>
</skill>
<skill id="7007" levels="4" name="Greater Seal of Flame">
<!--Done by KID-->
  <table name="#dmg"> 77 94 111 178 </table>
  <table name="#mpConsume"> 97 115 142 153 </table>
  <table name="#power"> 5.0 6.0 7.0 12.0 </table>
  <set name="mpConsume" val="#mpConsume"/>
  <set name="save" val="2"/>
  <set name="power" val="#power"/>
  <set name="target" val="TARGET_AREA"/>
  <set name="skillRadius" val="500"/>
  <set name="hitTime" val="4000"/>
  <set name="element" val="2"/>
  <set name="reuseDelay" val="20000"/>
  <set name="skillTime" val="4000"/>
  <set name="skillType" val="DOT"/>
  <set name="isMagic" val="true"/>
  <set name="operateType" val="OP_ACTIVE"/>
  <set name="buffDuration" val="15000"/>
  <set name="castRange" val="-1"/>
  <set name="effectRange" val="-1"/>
<for>
   <effect count="15" name="DamOverTime" time="1" val="#dmg"/>
</for>
</skill>
<skill id="7029" levels="4" name="Super Haste">
  <set name="power" val="0.0"/>
  <set name="target" val="TARGET_SELF"/>
  <set name="skillType" val="CONT"/>
  <set name="operateType" val="OP_TOGGLE"/>
  <set name="castRange" val="-1"/>
  <set name="effectRange" val="-1"/>
  <table name="#mpConsumeRate"> 1.0 1.0 5.0 0.1 </table>
  <table name="#runSpd"> 2 3 4 5 </table>
  <table name="#pAtk"> 1 1 1 50 </table>
  <table name="#mAtkSpd"> 2 3 5 5 </table>
  <table name="#pAtkSpd"> 1000 1100 1200 1301 </table>
  <table name="#mReuse"> 1 2 3 3 </table>
  <for>
   <effect name="Buff" time="9999998" count="1" val="0">
    <mul order='0x50' stat='runSpd' val="#runSpd"/>
    <mul order='0x50' stat='pAtk' val="#pAtk"/>
    <mul order='0x50' stat='mAtkSpd' val="#mAtkSpd"/>
    <set order='0x50' stat='pAtkSpd' val="#pAtkSpd"/>
    <mul order='0x50' stat='mpConsumeRate' val="#mpConsumeRate"/>
    <div order='0x50' stat='mReuse' val="#mReuse"/>
   </effect>
  </for>
</skill>

<skill id="7030" levels="1" name="Summon King Bugbear">

<table name="#itemConsumeCount"> 8 </table>
<set name="itemConsumeId" val="1458"/>
<set name="mpConsume" val="3"/>
<set name="power" val="0.0"/>
<set name="target" val="TARGET_SELF"/>
<set name="itemConsumeCount" val="#itemConsumeCount"/>
<set name="hitTime" val="4000"/>
<set name="reuseDelay" val="18600000"/>
<set name="skillTime" val="8000"/>
<set name="skillType" val="SUMMON"/>
<set name="isMagic" val="true"/>
<set name="operateType" val="OP_ACTIVE"/>
<set name="castRange" val="-1"/>
<set name="effectRange" val="-1"/>
<!-- Summon-specific -->
<table name="#npcIds">
150
</table>
<set name="npcId" val="#npcIds" />
<set name="expPenalty" val="0.3" />
<set name="isCubic" val="false" />

<for>

</for>

</skill>
<skill id="7031" levels="1" name="Summon Skeleton Royal Guard">

<table name="#itemConsumeCount"> 8 </table>
<set name="itemConsumeId" val="1458"/>
<set name="mpConsume" val="3"/>
<set name="power" val="0.0"/>
<set name="target" val="TARGET_SELF"/>
<set name="itemConsumeCount" val="#itemConsumeCount"/>
<set name="hitTime" val="4000"/>
<set name="reuseDelay" val="18600000"/>
<set name="skillTime" val="8000"/>
<set name="skillType" val="SUMMON"/>
<set name="isMagic" val="true"/>
<set name="operateType" val="OP_ACTIVE"/>
<set name="castRange" val="-1"/>
<set name="effectRange" val="-1"/>
<!-- Summon-specific -->
<table name="#npcIds">
622
</table>
<set name="npcId" val="#npcIds" />
<set name="expPenalty" val="0.3" />
<set name="isCubic" val="false" />
</skill>

<skill id="7032" levels="1" name="Summon Hunter Gargoyle">
<table name="#itemConsumeCount"> 8 </table>
<set name="itemConsumeId" val="1458"/>
<set name="mpConsume" val="3"/>
<set name="power" val="0.0"/>
<set name="target" val="TARGET_SELF"/>
<set name="itemConsumeCount" val="#itemConsumeCount"/>
<set name="hitTime" val="4000"/>
<set name="reuseDelay" val="18600000"/>
<set name="skillTime" val="8000"/>
<set name="skillType" val="SUMMON"/>
<set name="isMagic" val="true"/>
<set name="operateType" val="OP_ACTIVE"/>
<set name="castRange" val="-1"/>
<set name="effectRange" val="-1"/>
<!-- Summon-specific -->
<table name="#npcIds">
241
</table>
<set name="npcId" val="#npcIds" />
<set name="expPenalty" val="0.3" />
<set name="isCubic" val="false" />
</skill>

<skill id="7033" levels="1" name="ZERO">
<!-- skill ZERO -->
  <set name="target" val="TARGET_SELF"/>
  <set name="skillType" val="CONT"/>
  <set name="operateType" val="OP_TOGGLE"/>
  <set name="castRange" val="-1"/>
  <set name="effectRange" val="-1"/>
  <table name="#zero"> 2147483647 </table>
  <table name="#stat"> 50000 </table>
  <for>
    <effect count="0x7fffffff" name="ManaDamOverTime" time="30" val="0">
      <set order="0x50" stat="pAtk" val="#zero"/>
      <set order="0x50" stat="mAtk" val="#zero"/>
      <set order="0x50" stat="pDef" val="#zero"/>
      <set order="0x50" stat="mDef" val="#zero"/>
      <set order="0x50" stat="rCrit" val="#zero"/>
      <set order="0x50" stat="runSpd" val="800"/>
      <set order="0x50" stat="rEvas" val="#zero"/>
      <set order="0x50" stat="pAtkSpd" val="1300"/>
      <set order="0x50" stat="mAtkSpd" val="1890"/>
      <set order="0x50" stat="accCombat" val="#zero"/>
      <set order="0x50" stat="maxCp" val="#stat"/>
      <set order="0x50" stat="maxMp" val="#stat"/>
      <set order="0x50" stat="maxHp" val="#stat"/>
      <div order="0x50" stat="mpConsumeRate" val="2.0"/>
    </effect>
  </for>
</skill>
</list>
