<?xml version='1.0' encoding='utf-8'?>
<!DOCTYPE list SYSTEM "skills.dtd">
<list>
  <skill id="5600" levels="1" name="Betrayal Mark">
    <set name="target" val="TARGET_NONE" />
    <set name="skillType" val="NOTDONE" />
    <set name="operateType" val="OP_PASSIVE" />
    <set name="castRange" val="-1" />
    <for></for>
  </skill>
  <!-- NPC Short-Range Physical Resistance -->
  <skill id="5601" levels="12"
    name="Short-Range Physical Attack Resistance">
    <set name="target" val="TARGET_NONE" />
    <set name="skillType" val="NOTDONE" />
    <set name="operateType" val="OP_PASSIVE" />
    <set name="castRange" val="-1" />
    <for></for>
  </skill>
  <!-- Sacrifice. A state in which HP cannot be recovered. -->
  <skill id="5602" levels="1" name="Transform Sacrifice">
    <set name="target" val="TARGET_NONE" />
    <set name="skillType" val="NOTDONE" />
    <set name="operateType" val="OP_PASSIVE" />
    <set name="castRange" val="-1" />
    <for></for>
  </skill>
  <!-- A state in which MP consumption of skills is greatly decreased, and the probability of a vital spot jab is increased. -->
  <skill id="5603" levels="1" name="Dagger Mastery">
    <set name="target" val="TARGET_NONE" />
    <set name="skillType" val="NOTDONE" />
    <set name="operateType" val="OP_PASSIVE" />
    <set name="castRange" val="-1" />
    <for></for>
  </skill>
  <!-- A state in which MP consumption of skills is greatly decreased, and the success rate of stun attack is increased. -->
  <skill id="5604" levels="1" name="Blunt Mastery">
    <set name="target" val="TARGET_NONE" />
    <set name="skillType" val="NOTDONE" />
    <set name="operateType" val="OP_PASSIVE" />
    <set name="castRange" val="-1" />
    <for></for>
  </skill>
  <!-- Power of Apella. Increased M. Def., increased critical rate, and decreased critical power. -->
  <skill id="5605" levels="2" name="Power of Apella">
    <set name="target" val="TARGET_NONE" />
    <set name="skillType" val="NOTDONE" />
    <set name="operateType" val="OP_PASSIVE" />
    <set name="castRange" val="-1" />
    <for></for>
  </skill>
  <!-- Power of Apella. Increased Dodge, increased Atk. Spd., and decreased critical power. -->
  <skill id="5607" levels="2" name="Power of Apella">
    <set name="target" val="TARGET_NONE" />
    <set name="skillType" val="NOTDONE" />
    <set name="operateType" val="OP_PASSIVE" />
    <set name="castRange" val="-1" />
    <for></for>
  </skill>
  <!-- Power of Apella. Increased P. Def., increased M. Atk., and decreased Speed. -->
  <skill id="5608" levels="2" name="Power of Apella">
    <set name="target" val="TARGET_NONE" />
    <set name="skillType" val="NOTDONE" />
    <set name="operateType" val="OP_PASSIVE" />
    <set name="castRange" val="-1" />
    <for></for>
  </skill>
  <skill id="5609" levels="1" name="Sound 1">
    <set name="target" val="TARGET_NONE" />
    <set name="skillType" val="NOTDONE" />
    <set name="operateType" val="OP_PASSIVE" />
    <set name="castRange" val="-1" />
    <for></for>
  </skill>
  <skill id="5610" levels="1" name="Sound 2">
    <set name="target" val="TARGET_NONE" />
    <set name="skillType" val="NOTDONE" />
    <set name="operateType" val="OP_PASSIVE" />
    <set name="castRange" val="-1" />
    <for></for>
  </skill>
  <skill id="5611" levels="1" name="Sound 3">
    <set name="target" val="TARGET_NONE" />
    <set name="skillType" val="NOTDONE" />
    <set name="operateType" val="OP_PASSIVE" />
    <set name="castRange" val="-1" />
    <for></for>
  </skill>
  <skill id="5612" levels="1" name="Sound 4">
    <set name="target" val="TARGET_NONE" />
    <set name="skillType" val="NOTDONE" />
    <set name="operateType" val="OP_PASSIVE" />
    <set name="castRange" val="-1" />
    <for></for>
  </skill>
  <!-- Provides the ability to recover HP temporarily by damaging the enemy. Excludes damage caused by skills and long-range attacks. Effect 4. -->
  <skill id="5613" levels="4" name="Vampiric Rage">
    <set name="target" val="TARGET_NONE" />
    <set name="skillType" val="NOTDONE" />
    <set name="operateType" val="OP_PASSIVE" />
    <set name="castRange" val="-1" />
    <for></for>
  </skill>
  <!-- He was one of the Devil's retainers from Asmodae, and Beleth placed him among the people in order to rule Hellbound. Although he took over the power and turned Hellbound into the devil's territory after Beleth disappeared for magic experiments. Beleth does not really care about it. -->
  <skill id="5614" levels="1" name="Raid Boss - Level 87">
    <set name="target" val="TARGET_NONE" />
    <set name="skillType" val="NOTDONE" />
    <set name="operateType" val="OP_PASSIVE" />
    <set name="castRange" val="-1" />
    <for></for>
  </skill>
  <!-- He was created when a large number of elemental spirits that were constrained in the basement of Tower of Naia were transformed after being affected by Beleth's magic and Core Naia. Although it is a monster with an unstable shape and mind, which is  
    <skill id="5615" levels="1" name="Raid Boss - Level 87">
    <set name="target" val="TARGET_NONE" />
    <set name="skillType" val="NOTDONE" />
    <set name="operateType" val="OP_PASSIVE" />
    <set name="castRange" val="-1" />
    <for></for>
    </skill>
    <!-- He was created when a large number of elemental spirits that were constrained in the basement of Tower of Naia were transformed after being affected by Beleth's magic and Core Naia. Although it is a monster with an unstable shape and mind, which is  
    <skill id="5616" levels="1" name="Raid Boss - Level 87">
    <set name="target" val="TARGET_NONE" />
    <set name="skillType" val="NOTDONE" />
    <set name="operateType" val="OP_PASSIVE" />
    <set name="castRange" val="-1" />
    <for></for>
    </skill>
    <!-- He was created when a large number of elemental spirits that were constrained in the basement of Tower of Naia were transformed after being affected by Beleth's magic and Core Naia. Although it is a monster with an unstable shape and mind, which is  
    <skill id="5617" levels="1" name="Raid Boss - Level 87">
    <set name="target" val="TARGET_NONE" />
    <set name="skillType" val="NOTDONE" />
    <set name="operateType" val="OP_PASSIVE" />
    <set name="castRange" val="-1" />
    <for></for>
    </skill>
    <!-- He was created when a large number of elemental spirits that were constrained in the basement of Tower of Naia were transformed after being affected by Beleth's magic and Core Naia. Although it is a monster with an unstable shape and mind, which is  
    <skill id="5618" levels="1" name="Raid Boss - Level 87">
    <set name="target" val="TARGET_NONE" />
    <set name="skillType" val="NOTDONE" />
    <set name="operateType" val="OP_PASSIVE" />
    <set name="castRange" val="-1" />
    <for></for>
    </skill>
    <skill id="5619" levels="1"
    name="Presentation - Super Giant Mutated Animal">
    <set name="target" val="TARGET_NONE" />
    <set name="skillType" val="NOTDONE" />
    <set name="operateType" val="OP_PASSIVE" />
    <set name="castRange" val="-1" />
    <for></for>
    </skill>
    </list>
  -->